"Our teams are now reporting that this is resolved! Downloads should be working normally, so please feel free to giv… ", Minecraft Bedrock - iOS only: some players have said they can log in if they switched to cellular data. We are continuing…,We’ve heard that some of you are having trouble downloading purchased content. Our investigative teams are working… ,We just received word that users should now be able to access purchased content again. We appreciate your reports.… ,We understand some of you are also having trouble accessing purchased content and in-game content on the Xbox One.… ,We've received word that some of you are having trouble downloading purchased content on the Xbox One. Our team is… ,Our teams have let us know that you should now be able to download previously purchased content. Thank you for your… ,We understand some of you might be having trouble downloading content you've purchased in the Store. Our teams are… ," Hello. Try unplugging your console from the electrical outlet for 5 minutes. Plug it back in, power up… ",We have received word that users should now be able to view products listed on Xbox Marketplace.  Thank you for you… , Please feel free to DM us as we'd like to help. TIA," Hello! I would suggest resetting your console and going with the option to ""Keep my Games and Apps""… ", We have received word from our teams that users are unable to view products listed on the Store page f… ,We have received word from our teams that users are unable to view products listed on the Store page for Xbox One c… , Feel free to send us a DM! We'd like to help you out in getting your game installed. TIA, Go to the websites  or  and sign in to your Microsoft acco… , Hello. It definitely sounds like you signed into the wrong account or downloaded the wrong account to yo… , Hello. I would suggest setting up a callback from an Xbox Customer Support agent: … ," Hello! I would suggest resetting your console and going with the option to ""Keep my Games and Apps"". This… "," Destiny 2 maintenance is complete.

Console players who encounter issues updating to 2.7.0.2 should restart their console a…"," Only send the controller body itself. Please keep the case, thumbsticks, D-pad &amp; any other peripherals.… ", Destiny 2 Hotfix 2.7.0.2 has begun rolling out across all platforms and regions. Ongoing Destiny 2 maintenance is expected…,We have received word from our teams that users unable to browse by category in the Xbox One console Store should n… ," ℹ️Maintenance is complete, and the  NA and EU #XboxOne megaservers are available. Patch notes: …",We are aware of issues browsing by category in the Xbox One store. Our teams are looking into this and we will upda… ,We've received word that the maintenance for eFootball PES 2020 has completed! Thank you for all of the reports. As… , ℹ️The  NA and EU megaservers are currently unavailable while we perform maintenance. #ESO,"We are aware that maintenance for eFootball PES 2020 has begun, and servers are currently unavailable. We will upda… ", Hello To set up a callback from an Xbox Customer Support agent you'll need to click on the following link:… ," Hello! I would suggest resetting your console and going with the option to ""Keep my Games and Apps"". This… ",Managing payment options on the Xbox One should now be working normally. Thanks for sticking with us while things g… , You may need to have the controller replaced. You can check the warranty &amp; set this up online. We r… ,"Our teams are aware of an issue with editing payment options on Xbox One. It's being worked on, but in the meantime… ", Hello. We would suggest setting up a callback from an Xbox Customer Support agent:… , Hello. We would suggest setting up a callback from an Xbox Customer Support billing agent:… , Hello. I would suggest setting up a callback from an Xbox Customer Support billing agent:… ," Hello! I would suggest resetting your console and going with the option to ""Keep my Games and Apps"". Thi… ", If this is the only game that you're experiencing that particular issue with.. I would suggest unins… ," Hello! I would suggest resetting your console and going with the option to ""Delete Everything"". This wo… "," Hello. If you're only having issues with that one game, I'd suggest uninstalling and reinstalling the game.… ", Hello. Set up a callback from an Xbox Customer support agent and they'll be able to take care of it for… , We'd like to assist you as best as possible! Send us a DM &amp; we'd be glad to help further. TIA, Xbox Support at any level has no leverage/communication with the Enforcement team in charge of bans/su… ," When setting up a callback for an Xbox Support agent, go with another category somewhat similar to your… "," ℹ  76 has concluded maintenance on PC, PlayStation 4, and Xbox One. Please check  for m…"," Hello. Like I mentioned in the previous tweet, you can speak to a billing agent and you do also have th… ", Hello. It usually takes 24-72 hours to get a refund request email response. You can set up a callback f… , Hello! Set up a callback from an Xbox Customer Support billing agent by clicking on the following l… ," ℹ  76 is undergoing maintenance on PC, PlayStation 4, and Xbox One. Please check  for m…"," Agents, maintenance is over! Welcome back in DC!","All clear! We're able to join normally now, so please feel free to load up and play. We'll be here and listening for all your reports.","If you're unable to matchmake in World of Tanks: Mercenaries, this is due to maintenance and should be back to norm… "," Greetings Agents,

🛠 We will be performing a maintenance on #TheDivision2 today. No player facing changes.

🕑 Expected…"," Hello, you can check the status of Xbox Live through this link  No active… "," Hello! I would suggest resetting your console and going with the option to ""Keep my Games and Apps"". This… "," Hello! I would suggest resetting your console and going with the option to ""Keep my Games and Apps"". This wou… "," Hello. I would suggest resetting your console and going with the option to ""Keep my Games and Apps"". T… "," Hello, a child account will remain a child account based on the date of birth chosen when the Microsoft… "," That's definitely a unique situation. During all my years as an agent and Xbox Twitter Support, I've… ", When you were setting up each Xbox (with your profile).. Were you going into the console settings an… ," Yes. When setting up an Xbox with your Profile, it automatically sets it as the Home Xbox bc it's th… "," Hello. Sadly, the enforcement team does not have a support line where you'd be able to speak to someone.… ", Hello. Select any other option somewhat related/similar to your issue. The goal is just to connect w… ," From what you've described, I would suggest going with the full factory reset [Delete everything] opt… "," Hello, for assistance with your billing inquiry, please consult our customer support team. Our team… ", Hello. To set up a callback from an Xbox Customer Support agent click on the following link and follow… ," Hello. Sadly, we do not have the tools needed to make that happen. Click on the following link for more… ", Hello. I would suggest setting up a callback from an Xbox Customer Support billing agent:… , Hello.  This package was delivered on 12/23/19. If you are unable to locate this package please co… , Hello.  If you feel there has been a billing error please contact  UPS Billing  1-800-811-1648; Mond… , I understand how upsetting a delay can be. If any assistance is needed on checking options to obtain… , I understand how it can be concerning when there is a pending delivery. We'll gladly check the infor… , I am sorry for the delay.  Please continue to track your package(s) online for the latest updates as… ," It's frustrating when your package does not arrive as expected.  Please DM the tracking number, full de… ", I understand how a delay can be concerning. You will need to contact your shipper/seller for any refun… , I understand how concerning a delay can be. If any assistance is needed on checking options to obtain… ," I’m sorry about that. Let's see what is going on. Click the link to DM us your tracking number, phone n… ", I can understand your concerns regarding your package not being delivered. It is showing that the driv… , I can understand your concerns about your package showing that it was delivered and nothing was received.… ," I’m sorry about that. Let's see what is going on. Click the link to DM us your tracking number, phone… ", UPS standard delivery hours are 9 AM through 8 PM. Our delivery times can vary based on the driver’s… ," Thank you for reaching out to social media. Please, DM the detail of your concerns with the package del… "," Please DM us the tracking number, address, and phone number. ^JF "," Hi Chris, I am truly sorry for this inconvenience. I understand it is not the proper way to deliver a… ", I'm truly sorry that you're having a hard time on our website. We're more than happy to assist you. Pleas… ," Hello, thank you for reaching out to us, we are here to help you.
Please DM us your information such as… ", Are you the shipper or the receiver? ^J.K," I'm sorry that happened. Do you have the package? Click the link to DM us your tracking number, ph… "," Hi, thank you for bringing this information to our attention. Please DM your best contact phone number al… ", Sorry that you feel this way. Is there something that we can assist with? Click the link to DM your track… , I can understand your concerns about your package showing that it was delivered and nothing was received.… , Are you trying to pick up a package for someone else or is this your package? Click the link to DM us… ," We are truly sorry that the package arrived it that condition. 
Please, DM us your information such as: the… "," I do apologize for the inconvenience you're having, and thank you for letting us know about this issu… "," Hi, seems like your having trouble with your delivery. Please DM us details of your concern includ… "," Hello, thank you for bringing this issue to our attention, we are here to help you.
Please DM us your info… "," Plz DM the track #, delivery address. Include a PH #.^LG "," We're on social media to address, assist, and possibly resolve UPS customers' concerns with their package… "," Hi, our team is here to help. Please DM us your tracking number, address, and phone number. ^GC "," Hi Morgan, our team will be happy to help you.Please DM us the tracking number, confirmation of the deliv… "," Hi, please DM us your tracking number, address, and phone number to check on your package. ^JF ", Our Customer Support team will be able to further review your concerns with you. Please send a DM with you… ," I do apologize for the inconvenience you're having, and thank you for letting us know about this i… "," Hi, we can check alternate options for you. Feel free to DM us your tracking number, address, and phon… "," We'd like to look into this for you, Jaide. Please click the link to DM us with your tracking number,… ", Our Customer Support team will be able to further review your concerns with you. Please send a DM with you… ," Hey there, thank you for reaching out to us. Are you trying to pay the shipping charges to return the packa… "," I do apologize for the inconvenience you're having, and thank you for letting us know about this issue.… "," Hi there, I do show that your concern has been already escalated to the UPS Store Corporate Office.… "," I do apologize for the inconvenience you're having, and thank you for letting us know about this issue.… "," Hello Claudio, if you need support with a delivery, please DM us your information such as tracking numbe… "," Hello Ruby, thank you for reaching out to us and telling us your concern, we would like to support you… ", Please DM your tracking number and we will check the status of your package. ^QJ ," Hi, our team is here to help. Please DM us your tracking number, address, and phone number to assist… "," Hi, our team is here to help you. Please DM us the tracking number, confirmation of the delivery addres… "," Please DM the tracking number, complete address, and telephone number and we will look into this for you. ^… "," Hi, we understand your concern, our team is here to help you. Please DM us, your tracking number, p… "," Hi, please DM us your tracking number, so we can take look into it. ^SA "," Hi, we are here to assist. Please DM us your tracking number, phone number, and ship-to address, so we… ", Please DM your name and complete address so we can reach out to the local center and have someone con… ," We can arrange to have this matter looked into. Please send your tracking number, complete delivery addr… "," Hi, we understand your concern, our team is here to help you. Please DM us, your tracking number, phone… "," Hi, we're sorry to see this. Please DM us your tracking number, address, and phone number. ^GC ", I am sorry to hear that you are having a bad experience with the service. Please DM us with your trackin… , I am sorry to hear that you are having a bad experience with the service. Please DM us with your tracki… ," Hi, we understand your concern, our team is here to help you. Please DM us your tracking number, phone n… ", Our Customer Support team will be able to further review your concerns with you. Please send a DM w… , Our Customer Support team will be able to further review your concerns with you. Please DM the del… ," Hi, we understand your concern, our team is here to help you. Please DM us your tracking number phone… "," Jen, we understand your concern with your package that shows delivered but you do not have it. We would l… "," How may I help you today? Are you having problems with a delivery? If so, please DM the tracking number,… "," Hi, we can definitely help you. Feel free to DM us your tracking number, address, and phone number… "," Unfortunately, in order to make any changes to the package, you'll need to contact the shipper to ha… "," Hi, thank you for contacting us, our team is here to help. Please DM us your tracking number, delivery ad… ", UPS has a contract with the shipper to take a package to the access point after a failed delivery attem… , Did you pay for Saturday delivery? We can arrange to have this matter looked into. Please send your trackin… , I am sorry you are having trouble.  For UPS Netherlands Tech Support please contact +31 (0) 20 50 40 602.  ^RF, Please feel free to reach out to us via a DM if we can be of assistance. We'll need your first/las… , Please feel free to reach out to us via a DM if we can be of assistance. We'll need your first/last name… ," Please DM the tracking number, full delivery address, and contact number for my team to review the package status. ^RF", You may click the 3 bars on the top-right scroll down to where you see the name of the country - click h… , Please feel free to reach out to us via a DM if we can be of assistance. We'll need your first/last name… , I am sorry for the delay due to severe weather.  Delivery has not yet been updated.  Please continue t… ," Hello. I am sorry the driver did not pickup.  Please DM the tracking number(s), pickup request num… ", I understand how it can be concerning when there is a pending delivery. We'll gladly check the information… , I am happy to hear this. Thank you for the update. Take care. ^KD, I see that a case was submitted to our resolutions team yesterday. The resolutions team reached out t… ," Hello.  The local team is closed for the weekend.  Any delivery change at this time would be for Tuesday availability.  

^RF", Hello.  Do you need assistance with a package?  ^RF, I understand how it can be concerning when there is a pending delivery. We'll gladly check the informat… , I can see how that would be of concern. We'd like to look into this. Please provide us with your tra… , I understand how upsetting it is to receive a package in unexpected conditions. If you would like assi… ," I am sorry to hear that you feel this way. Please provide your first/last name, tracking number, co… ", It’s perfectly understandable that you’re very upset about the way your package was delivered. We… ," Hello Frank, I am truly sorry to read about this issue with your delivery.  Please DM us your tracki… "," I can see how that would be upsetting. Please click the link to DM us with your tracking number, phone n… "," The driver is most likely delivering other packages, once they get to yours they should attempt del… "," Looks like an attempt was made today; however, the COD money for the taxes due was not available. The pa… ", It seems you're having a problem with your delivery. We would like to assist you in any possible way… , You're welcome. ^LG ," 3 pm is usually for businesses, by the end of day is usually for residential deliveries.  If you can provid… "," Hi, we're more than happy to check on your package. Please DM us your tracking number, address, and… "," Hello Rosemary, I am truly sorry to read that you've been having issues with our service. Please DM… "," Where? Ivy Park x Adidas is pure🔥 🔥.  Queen Bey, did not come to play chileee! ^EB"," Sorry to keep you waiting for this package. Please send us a DM with your tracking number, delivery address a… ", Does the building require a security key/access code? ^KS ," Thanks, for contacting us on social media. This an easy fix. Provide the UPS tracking number, your del… ", It seems you're having a problem with your delivery. My team and I will be happy to assist you. Please… , I am so sorry for the way your package was delivered. We would like to have this addressed with the local te… , Sorry to keep you waiting for your package. Drivers try to have all deliveries completed by 8:00 PM bu… ," I can see how that would be upsetting, and would feel the same way. Please click the link to DM us wit… "," I'm sorry to hear it! If you'd be willing to DM us back with the tracking numbers, the delivery addre… "," We'd like to look into this for you, Sophie. Please click the link to DM us with your tracking number, pho… ", Hi there. It sounds like there may be some troubles with a delivery. We would like to help you. Can you D… ," I am sorry you feel this way. We would like to help you. Can you DM the tracking number, full addr… "," Hi, we would like to help you in any possible way with your concerns. Please DM more details such as t… "," Hey, Hugh, Please, DM the detail of your concerns with the package delivery, or our company. Include… ", Have the friend initiate a damage package investigation with UPS. Claims Support… , Hi there. It sounds like there may be some troubles with a delivery. We would like to help you. Can you… ," ...  if you would be able to DM us back with a tracking number, delivery address, and your phone number. ^… "," I'm sorry to hear you had this experience! Typically, in a situation like this, we'd recommend you contact… "," We typically try to delivery by 8, but  hours are often extended well beyond that time. We're happy you… "," I'm sorry that this happened. Click the link to DM us your tracking number, phone number, and delive… "," We'd be happy to look into this for you. Please click the link to DM us with your tracking number, phon… "," Hello Chad, I apologize for this issue. Please check your DM's for further assistance. ^LM. "," I understand you're upset, and we'd like to help. Please provide us with your tracking number, phone number… "," Unfortunately, the video is not very clear. Is anything damaged? Click the link to DM us with your tr… ", Hey there. It sounds like you may be having some troubles with a delivery. We would like to help.… , Hey there. It sounds like you may be having some troubles with a delivery. We would like to help. Ple… ," Hey there. We would be more than happy to look into this for you. DM the tracking number, complete d… "," Hey there. We would be more than happy to look into that for you. Please DM the tracking number, com… "," Sorry to keep you waiting for this package. If you don't receive your package today, feel free to DM us… ", I responded to you through a direct message. ^SM ," I understand your concern, and would like to look into this on your behalf. Please provide us with your t… "," Hello, I am truly sorry to read about this issue with your shipment. Please DM us your tracking number, d… "," Sorry to hear this. Please send us a DM with your tracking number, delivery address and phone number… ", I'm sorry to hear you've had a bad experience! I'd like to look into the details of your situation a… , Hi there. It sounds like there may be some troubles with a delivery. We would like to help you. Can yo… , Hi there. It sounds like there may be some troubles with a delivery. We would like to help you. Can you… ," We try to deliver all packages by 8 pm; however, hours are often extended. Please click the link to… ", I'm sorry to see that this was how your packages were left. Were any of the contents damaged? Click th… , Thank you for bringing this to our attention. I am sorry that this happened and definitely understand your… ," We'd be happy to look into this for you. Please click the link to DM us with your tracking number,… ", Hey there. I am sorry to see that you feel this way.  It sounds like you may be having some trouble… ," Thanks for making us aware of this matter and allowing us to respond. Please DM the tracking number,… "," I'm sorry to hear it! Would you be able to DM us back with the tracking number, delivery address, and… "," I'm sorry to hear this happened. At this time, I recommend Dom contact local HR at his earliest conven… ", Hey there. It sounds like you may be having some troubles with a delivery. We would like to help.… , I'm sorry to see your packages were delivered this way! Would you be able to DM us back (link below… ," Hi, I can definitely understand the reason for your frustration. Please DM us your tracking number… "," Hi, our team is here to help. Please DM us your tracking number, address, and phone number for assis… "," Thank you for reaching out, were your direct items damaged? If so please click the link below to send u… ", Our Customer Support team will be able to further review your concerns with you. Please send a DM with… ," Hi, thank you for bringing this to our attention, our team is here to help. Please DM us with your trac… "," I'm sorry if you've had a bad experience! If you'd want to send us a DM back with the tracking number,… ", I can understand your concerns regarding not being notified of your deliveries and getting this notice l… ," Is there a particular package we can assist you with? If so, please DM us using the following link. ^… "," Do you need assistance with your shipment? If so please DM us your full name, complete address, phon… ", We're sorry about this! Would you be able reply back to us in DM? If you look on the package for a l… ," Hi there, I truly apologize for the issue. Please DM us your name, phone number, tracking number an… ", I am sorry to hear this happened. We'll be happy to see what options are available. Please DM us using t… , I am very sorry that your phone communication has been such a poor experience. My team is here and… , Hey there. It sounds like you may be having some troubles with a delivery. We would like to help. P… ," Greetings, 
I am displeased to see this. Those clothes gotta get clean, Please contact Amazon for f… ", DM us your tracking number and delivery adress. ^QH," Our team is here to help you. Please DM us your tracking number, delivery address, name and best c… ", I am sorry to hear this. We'd like to assist. Please DM us the details using the following link. ^… ," Hi Sage, please DM us the tracking number, your delivery address and phone number to further assist y… "," Hi, we can review your request. Feel free to DM us your address, phone number and a recent tracking numb… ", Could you be so kind as to check your DM? We have shared information about your shipment. ^ JD , Our Customer Support team will be able to further review your concerns with you. Please send a DM wi… , Our Customer Support team will be able to further review your concerns with you. Please send a DM with… ," Hi, would you like us to review your case? Feel free to DM us your tracking number, address, and phone nu… ", I am truly sorry to hear this. We'd like to look further into this matter. Please DM us using the follo… , Our records indicate the package has been delivered. Have you received the package? ^MH," Sorry to hear that you had this happens. Click the link below, to send us your tracking number, phone n… "," Michael,
